book_id,title,categories,author_names,price,description
OL28758494W,ArcGIS 9.,"Handbooks, manuals; Geodatabases; Geographic information systems; Client/server computing; Relational databases; Systèmes d'information géographique; Guides, manuels; Architecture client-serveur (Informatique); Bases de données relationnelles; Géographie; Systèmes d'information; ArcSDE","Environmental Systems Research Institute (Redlands, Calif.)",,
OL28985861W,Relational Database Design for Starters,Relational databases; Microsoft access (computer program),Akmal Masood,,
OL29069587W,Windows Server 2008 Enterprise Administrator,Microsoft windows server (computer program); Sql server; Relational databases; Client/server computing; Database management,Microsoft Official Academic Course Staff,,
OL2921569W,Mastering Sybase SQL Server 1l,Client/server computing; Relational databases; SQL server; Sybase,Charles B. Clifford,93.02,
OL2921572W,SYBASE replication server primer,Client/server computing; Relational databases; Sybase,Charles B. Clifford,83.26,
OL28961112W,Hibernate shi zhan,Object-oriented programming (Computer science); Java (Computer program language); Computer software; Development; Relational databases; Programmation orientée objet (Informatique); Java (Langage de programmation); Bases de données relationnelles; JAVA yu yan; Cheng xu she ji; Hibernate (Electronic resource),Christian Bauer,,
OL28990983W,SQL Guide to Pervasive PSQL,Database management; Relational databases; Sql server,Rick F. van der Lans,,
OL29290780W,Access 95 One Step at a Time,Relational databases; Database management; Computer programs; Microsoft Access,Noel Kantaris; Phil Oliver,,
OL5800866W,Oracle9i new features,Electronic data processing personnel; Oracle (Computer file); Relational databases; ORACLE 9i; Oracle (computer system),"Freeman, Robert G.",157.79,
OL5800885W,BusinessObjects Enterprise Administrator's Guide,"Business, data processing; Relational databases; Businessobjects (computer program)",David McAmis,55.04,
OL5800867W,Oracle9i RMAN backup & recovery,Backup processing alternatives; Data recovery (Computer science); Electronic data processing; Oracle (Computer file); Relational databases; Oracle (computer system); Data recovery (computer science),"Freeman, Robert G.",41.95,
OL5800878W,Oracle9i JDBC programming,Internet programming; Java (Computer program language); Oracle (Computer file); Relational databases,Jason Price,63.5,
OL6300107W,A translation of relational database query languages into SIBYL,Query languages (Computer science); Relational databases; SIBYL (Computer program language); Programming languages (Electronic computers),David W. Dawson,115.61,
OL6303818W,Optimization of queries in relational databases,Relational databases,Yehoshua Sagiv,64.96,
OL6468357W,Oracle programmer's guide,Relational databases; SQL (Computer program language); Oracle (Computer file),"Pepin, David.",23.88,
OL6454765W,Relational data base systems,Relational databases,Jørgen Fischer Nilsson,66.16,
OL6221555W,Beginning SQL server 2008 programming,Relational databases; SQL server; Database management,Robert Vieira,163.58,
OL7834101W,Microsoft SQL Server 2005,Client/server computing; Relational databases; SQL server; Sql server,Dušan Petkovic,27.13,
OL7833831W,SQL from the ground up,Relational databases; SQL (Computer program language),Mary Pyefinch,64.98,
OL7833585W,Oracle Forms interactive workbook,"Client/server computing; Oracle (Computer file); Problems, exercises; Relational databases; Oracle (computer system); Database management",Baman Motivala,67.53,
OL5274361W,Oracle Utilities,Relational databases; Oracle (Computer file),Dave Moore,90.36,
OL4975924W,Theory of Relat Database 42-0,Relational databases,David Maier,,
OL6599994W,SAS/ACCESS 9.1 Supplement for SYBASE SAS/ACCESS For Relational Databases,Relational databases; SAS/ACCESS; Sybase,SAS Institute,168.68,
OL6599991W,SAS/ACCESS 9.1 Supplement For ODBC SAS/ACCESS For Relational Databases,Relational databases; SAS (Computer file); Microsoft ODBC,SAS Institute,153.52,
OL6599995W,SAS/ACCESS 9.1 Supplement For Teradata SAS/ACCESS For Relational Databases,Relational databases; SAS/ACCESS,SAS Institute,127.74,
OL6599990W,SAS/ACCESS 9.1 Supplement for Microsoft SQL Server SAS/ACCESS for Relational Databases,Relational databases; SAS/ACCESS; SQL server,SAS Institute,77.3,
OL6599984W,SAS/ACCESS 9.1 Interface to Relational Databases,User interfaces (Computer systems); Relational databases; Database management; SAS/ACCESS,SAS Institute,51.68,
OL6599993W,SAS/ACCESS 9.1 Supplement for Oracle SAS/ACCESS for Relational Databases,Relational databases; SAS (Computer file); Oracle (Computer file),SAS Institute,54.94,
OL6599987W,SAS/ACCESS 9.1 Supplement for DB2 Under UNIX and PC Hosts SAS/ACCESS For Relational Databases,SAS/ACCESS; IBM Database 2.; Relational databases,SAS Institute,23.47,
OL6599989W,SAS/ACCESS 9.1 Supplement for Informix SAS/ACCESS for Relational Databases,Relational databases; Informix software; SAS/ACCESS,SAS Institute,24.26,
OL6572532W,A relational data base management system,Relational databases; Banques de données; Gestion; Bases de données relationnelles; Database management,A. T. F. Hutt,88.52,
OL4831466W,"Adatmodellek, adatbázis-filozófiák",Database design; Relational databases,"Hannák, László.",32.29,
OL6214232W,SQL server on site,Client/server computing; Relational databases; SQL server,Anthony Sequeira,34.72,
OL6224886W,Oracle performance tuning 101,Oracle (Computer file); Relational databases; SQL (Computer program language),Gaja Krishna Vaidyanatha,88.69,
OL6214176W,Oracle8i DBA,Certification; Database management; Electronic data processing personnel; Examinations; Oracle (Computer file); Relational databases; Study guides,Zulfiqer Habeeb,32.34,
OL5740828W,Beginning SQL,Relational databases; SQL (Computer program language),John Kauffman,33.76,
OL5626154W,Problemy reprezentacji informacji w relacyjnych bazach danych,Relational databases,Tomasz Imieliński,153.8,
OL5299437W,Relational databases,Relational databases; Database management,Chao-Chih Yang,132.29,
OL5752588W,SQL Server 2000 stored procedure & XML programming,Client/server computing; Computer programming; Relational databases; SQL server; XML (Document markup language); Sql (computer program language),Dejan Sunderic,162.11,
OL5752587W,SQL Server 2000,Client/server computing; Computer programming; Relational databases; SQL server; COMPUTERS; Data Processing; Architecture client-serveur (Informatique); Bases de données relationnelles; Programmation (Informatique),Dejan Sunderic,62.37,
OL556938W,"Oracle DBA handbook, 7.3 edition",Oracle (Computer file); Relational databases; Bases de données relationnelles; Oracle (système informatique),Kevin Loney,25.7,
OL556937W,Oracle database 11g,Database management; Oracle (Computer file); Relational databases,Kevin Loney,63.9,
OL556936W,Oracle9i instant PL/SQL scripts,Oracle (Computer file); PL/SQL (Computer program language); Relational databases,Kevin Loney,82.63,
OL556931W,Oracle8 DBA handbook,Oracle (Computer file); Relational databases,Kevin Loney,150.18,
OL556935W,Oracle9i DBA handbook,Oracle (Computer file); Relational databases; Oracle (computer system),Kevin Loney,139.88,
OL5473637W,Bases de données et systèmes relationnels,Relational databases; Base donnée relationnelle; Architecture SGBD; Modèle hiérarchique; Langage manipulation donnée; Modèle réseau; Intégrité base donnée; SGBD; Modèle donnée; Bases de données,C. Delobel,78.72,
OL5858960W,Expert Oracle Database 10g Administration (Expert's Voice),Relational databases; Oracle (Computer file); Oracle (computer system),Sam R. Alapati,91.84,
OL5748932W,Effective Oracle by design,Database design; Oracle (Computer file); Relational databases; Oracle (computer system),Thomas Kyte,129.12,
OL5759532W,Easy Oracle PL/SQL Programming,Relational databases; PL/SQL (Computer program language); Oracle (Computer file); Database management,John Garmany,77.13,
OL5760387W,Oracle Initialization Parameters,Database management; Oracle (Computer file); Relational databases; Oracle (computer system),David C. Kreines,111.75,
OL5858959W,Expert Oracle9i database administration,Database management; Oracle (Computer file); Relational databases; Oracle (computer system),Sam R. Alapati,21.95,
OL5747140W,Oracle9i performance tuning tips & techniques,Oracle (Computer file); Relational databases; Oracle (computer system),Richard J. Niemiec,46.43,
OL5743913W,Introducing Microsoft SQL server 2005 for developers,Client/server computing; Database management; Relational databases; SQL server,Peter DeBetta,72.42,
OL5743078W,OCP Oracle database 11g,"Certification; Database management; Electronic data processing personnel; Examinations; Oracle (Computer file); Study guides; Oracle (computer system); Relational databases; Electronic data processing personnel, certification",Robert J Bryla,95.29,
OL28620008W,Learning SQLite for IOS,"Relational databases; Database management; Application software, development; Operating systems (computers)","(Hons), Gene Da Rocha, MSc, BSc",,
OL4642487W,Relational Database Design,Relational databases; Database design,Charles J. Wertz,166.92,
OL4538870W,Relational Database Systems,Relational databases,Joachim Schmidt,97.01,
OL4519650W,Oracle Job Scheduling,Relational databases; Oracle (Computer file),Timothy Hall,,
OL4995270W,The database experts' guide to SQL,Database management; Relational databases; SQL (Computer program language); Datenbank; SQL,Frank Lusardi,127.1,
OL6599992W,SAS/ACCESS 9.1 Supplement For OLE DB SAS/ACCESS For Relational Databases,Relational databases; SAS/ACCESS; OLE (Computer file),SAS Institute,87.41,
OL8273333W,Oracle Developer Forms Techniques (Other Sams),Oracle (computer system); Development; Relational databases; Oracle (Computer file); Application software; COMPUTERS; Desktop Applications; Databases; Database Management; General; System Administration; Storage & Retrieval; Engineering & Applied Sciences; Computer Science,Bulusu Lakshman,25.07,
OL8273440W,e-Commerce Applications Using Oracle8i and Java From Scratch,Java (Computer program language); Relational databases; Oracle (Computer file); Electronic commerce; Java (computer program language); Oracle (computer system); Bases de données relationnelles; Java (Langage de programmation); Commerce électronique; COMPUTERS; Programming; Open Source; Software Development & Engineering; Tools; General; Engineering & Applied Sciences; Computer Science,Meghraj Thakkar,140.73,
OL5913591W,Relational information systems,Relational databases; Data base management; Information storage and retrieval systems; Database management,T. H. Merrett,116.05,
OL5836808W,Microsoft Access 2007 data analysis,Database management; Microsoft Access; Relational databases; Microsoft access (computer program),Michael Alexander,163.15,
OL6431071W,Using an extensible language to specify the design of a relational database,Programming languages (Electronic computers); Relational databases,Garry R. Kampen,119.14,
OL8020883W,Modern Database Systems,Object-oriented databases; Relational databases,Won Kim,113.3,
OL8021876W,Essential SQL Server 2000,Client/server computing; Relational databases; SQL server; Sql server,Buck Woody,83.82,
OL8021890W,Guerrilla Oracle,Relational databases; Microsoft Windows (Computer file); Oracle (Computer file); Oracle (computer system); Microsoft windows (computer program),Richard Staron,103.42,
OL8021676W,Oracle8i Tuning and Administration,Relational databases; Oracle (Computer file); Oracle (computer system),Heidi Thorpe,157.99,
OL8019858W,Scaling Oracle8i,Relational databases; Oracle (Computer file); Database design,James Morle,128.17,
OL8206058W,Microsoft SQL Server 2000 Weekend Crash Course,Relational databases; Client/server computing; Microsoft SQL Server (Computer file); SQL server; Sql server,Alex Kriegel,120.06,
OL8408205W,CodeNotes for Oracle 9i,Relational databases,Gregory Brill,86.99,
OL8412551W,DB2 Cube Views,Relational databases; OLAP technology; IBM Database 2.,IBM Redbooks,134.13,
OL8413495W,Managing Oracle 8.1.7 on Os/390,Relational databases; Oracle (Computer file); OS/390,IBM Redbooks,31.63,
OL8414001W,Using Discontiguous Shared Segments And Xip2 Filesystems With Oracle Database 10g on Linux for IBM System Z,Relational databases; Oracle (Computer file),IBM Redbooks,37.37,
OL8413527W,Migrating to DB2 Udb Version 7.1 in a Visual Warehouse Environment,Relational databases; IBM Database 2.; Visual Warehouse,IBM Redbooks,86.02,
OL8412329W,An Introduction to Tivoli Manager for Oracle 2.0,Database management; Relational databases; Tivoli storage manager; Oracle (Computer file),IBM Redbooks,50.38,
OL8412615W,DB2 Web Query Tool Version 1.2,Relational databases; SQL (Computer program language); IBM Database 2.,IBM Redbooks,31.74,
OL8412799W,Experiences With Oracle for Linux on Zseries,Relational databases; Oracle (Computer file); Linux,IBM Redbooks,36.91,
OL8833901W,SAS/ACCESS 9.1.2 Supplement for MySQL,Relational databases; SAS/ACCESS; MySQL (Electronic resource),SAS Publishing,142.78,
OL8843803W,Personal Oracle Real Application Clusters,Relational databases; Computational grids (Computer systems); Oracle (Computer file),Edward Stoever,88.61,
OL8412798W,Experiences With Oracle Database 10g on Z/os,Relational databases; Oracle (Computer file); Z/OS,IBM Redbooks,78.74,
OL8407744W,Microsoft  SQL Server(TM) 2000 Programming Step by Step (Dv-Dlt Fundamentals),Relational databases; Client/server computing; SQL server,Rebecca Riordan,76.36,
OL8407711W,Inside Microsoft SQL Server 2000,Relational databases; Client/server computing; SQL server,Kalen Delaney,162.76,
OL8407710W,Inside Microsoft SQL Server 2000,Client/server computing; Relational databases; SQL server,Kalen Delaney,56.42,
OL8584985W,Relational Database Principles (Computing Textbooks),Relational databases,Colin Ritchie,130.54,
OL8508749W,Oracle8i and Microsoft SQL Server Integration (With CD-ROM),Relational databases; Oracle (Computer file); SQL server; Sql server,Stephen Chelack,34.57,
OL8273766W,PostgreSQL,Relational databases; Database management; Open source software; PostgreSQL,Korry Douglas,23.95,
OL3508931W,Interactive SQL on the AS/400,IBM AS/400 (Computer); Relational databases; SQL (Computer program language); Programming; Database management,John F. Hovell,57.01,
OL3509138W,A guide to SQL programming for Rdb,Relational databases; SQL (Computer program language),"Willis, John M.",128.71,
OL3488689W,The Informix DBA Survival Guide,Relational databases; Informix-SQL,Joe Lumbley,162.52,
OL3496125W,The database book principles & practice,Relational databases; Oracle (Computer file); Databases,Narain Gehani,43.77,
OL3954624W,Relational database design and implementation using DB2,Database design; IBM Database 2.; Relational databases; Computer architecture,Stephen L. Montgomery,32.2,
OL4095904W,Working with Oracle,Oracle (Computer file); Relational databases,Jack L. Hursch,158.9,
OL4095905W,Working with Oracle version 6.0,Oracle (Computer file); Relational databases,Jack L. Hursch,163.16,
OL4096159W,The paradox relational database advisor,Paradox (Computer file); Relational databases,Kimberly Maughan Saunders,141.63,
OL3909509W,SQL and relational basics,Relational databases; SQL (Computer program language); Sql (computer program language),Fabian Pascal,76.16,
OL3909510W,Understanding relational databases with examples in SQL-92,Relational databases; SQL (Computer program language),Fabian Pascal,94.27,
OL3833383W,Temporal modeling in relational database systems,Relational databases,Ludger Schäfers,36.28,
OL4120029W,Oracle/SQL,Oracle (Computer file); Relational databases; SQL (Computer program language),Tim Hartley,112.1,
OL4112512W,The problem of incomplete information in relational databases,Relational databases,G. Grahne,161.07,
OL4964941W,Strategy for data modelling,Data structures (Computer science); Relational databases,Vetter. M.,77.6,
OL4967461W,Translating relational queries into iterative programs,Computer programming; Functional programming languages; Relational databases,Johann Christoph Freytag,35.85,
OL5030598W,Algebraiczna metoda formułowania pytań w relacyjnym modelu bazy danych,Database management; Relational databases,Janusz Getta,52.09,
OL516117W,"Relational Database Design Clearly Explained, Second Edition (The Morgan Kaufmann Series in Data Management Systems)",Database design; Relational databases; Case studies,Jan L. Harrington,97.58,
OL4486881W,Using Oracle,Oracle (Computer file); Relational databases; SQL (Computer program language),Ted Crooks,44.86,
OL4618099W,Relational databases and knowledge bases,Sécurité donnée; Base donnée relationnelle; Modèle relationnel; Database management; SGBD; SGBD relationnel; Base donnée orientée objet; Langage requête; Bases de données relationnelles; Base connaissance; Fiabilité; Gestion; SQL; Base donnée déductive; Relational databases; Gestion base donnée; Base donnée distribuée; Bases de données; Data base management; Relational data bases,G. Gardarin,120.32,
OL4618062W,Analysis and comparison of relational database systems,Database management; Relational databases,Patrick Valduriez,83.16,
OL4444161W,Relational database system implementations,Relational databases; Database management,"Kim, Won",140.58,
OL4444160W,Query optimization for relational database systems,Relational databases,"Kim, Won",65.25,
OL4604675W,Managing ArcSDE services,"Handbooks, manuals; Relational databases; Geographic information systems",Mark Harris,150.91,
OL4445876W,Ingres user guide,Database management; Ingres (Computer file); Relational databases; Ingres (computer system),Peter Matthews,164.69,
OL4791874W,Interactive relational database design,Database design; Logic programming; Relational databases; Database management; Adatbázis tervezés; Bases de données; Conception; Bases de données relationnelles; Programmation logique; Relationales Datenbanksystem; Datenbankentwurf; TURBO-PROLOG; Relationele databanken; Logisch programmeren,Tapan P. Bagchi,145.4,
OL512957W,Microsoft Access 97 quick reference,Database management; Microsoft Access; Relational databases; Microsoft access (computer program),Rick Winter,46.16,
OL5039231W,Introduction pratique aux bases de données relationnelles (Collection IRIS),Information storage and retrieval systems; Computer science; Database management; Relational databases,Andreas Meier,76.39,
OL3820157W,SQL-Anfragen,Database management; Relational databases; SQL (Computer program language); Sql (computer program language),G. von Bültzingsloewen,161.49,
OL3669817W,Theoretische Grundlagen relationaler Datenbanksysteme,Relational databases,"Kandzia, Peter.",117.31,
OL3706108W,Using interactive recursive partitioning to improve rule-based expert systems,Database design; Decision making; Expert systems (Computer science); Recursive partitioning; Relational databases,Peter M. Meyer,73.32,
OL3681196W,Mnozhestvennai͡a︡ modelʹ dannykh v informat͡s︡ionnykh sistemakh,Database design; Distributed databases; Relational databases,M. M. Gilula,30.41,
OL3969665W,Database modeling in the PC environment,Database design; Microcomputers; Relational databases; Database management,Bradley Dyck Kliewer,148.86,
OL3860634W,Detecting redundant tuples during query evaluation,Query languages (Computer science); Relational databases; Query languages (computer science),Surajit Chaudhuri,46.67,
OL3899649W,SQL for DB2 and SQL/DS application developers,IBM Database 2.; Oracle (Computer file); Relational databases; SQL (Computer program language),Jonathan Sayles,35.35,
OL3899651W,SQL spoken here,IBM Database 2.; Oracle (Computer file); Relational databases; SQL (Computer program language); Relational data bases; Sql (computer program language),Jonathan Sayles,64.67,
OL4010468W,Relational databases,Relational databases,Val Occardi,59.62,
OL465804W,Microsoft  SQL Server(TM) 2005 Administrator's Pocket Consultant (Pro-Administrator's Pocket Consultant),Relational databases; Client/server computing; SQL server,William R. Stanek,103.99,
OL465803W,Microsoft  SQL Server(TM) 2000 Administrator's Pocket Consultant (It-Administrator's Pocket Consultant),Relational databases; Client/server computing; SQL server,William R. Stanek,53.48,
OL4625463W,Relational database technology,Relational databases; Base donnée relationnelle; Base donnée répartie; SGBD; Intégrité base donnée; Bases de données relationnelles; Conception base donnée; Gestion; Relationale Datenbank; Bases de données; Bases de datos relacionales; Computer science; Software engineering; Database management,Suad Alagić; Suad Alagić,48.57,
OL4118691W,INGRES and relational databases,Ingres (Computer file); Relational databases,David M. Rothwell,37.72,
OL4329778W,Oracle 7.3 developer's guide,Oracle (Computer file); Relational databases; SQL (Computer program language); Oracle (computer system),Lave Singh,166.31,
OL4366850W,Sintaksicheskie i semanticheskie struktury reli͡at͡sionnykh i͡azykov zaprosov,Relational databases,Gali͡a Mladenova Angelova,25.05,
OL4079366W,Extending a relational database with deferred referential integrity checking and intelligent joins,Database management; Relational databases,Stephanie Cammarata,70.34,
OL4079363W,An intelligent information dictionary for semantic manipulation of relational databases,Data dictionaries; Database management; Relational databases,Stephanie Cammarata,39.65,
OL4230003W,Dependencies in relational databases,Relational databases,B. Thalheim,38.32,
OL3482062W,Sybase/SQL server,Relational databases; SQL server; Sybase,Kola Ajisekola,119.79,
OL3493641W,Troubleshooting SQL,Relational databases; SQL (Computer program language),Forrest Houlette,129.36,
OL3553574W,File express companion,File express; Relational databases,Stephen T. Adams,165.5,
OL4296321W,Relational Database Design (Information Systems Series),Relational databases; Database design,Paul Beynon-Davies,138.1,
OL4276837W,The design of relational databases,Database design; Relational databases,Heikki Mannila,43.82,
OL4296784W,Working with Oracle development tools,ORACLE (Computer system); Relational databases; SQL (Computer program language),Graham H. Seibert,134.76,
OL4081365W,Using INFORMIX-SQL,Informix-SQL; Relational databases,Jonathan Leffler,25.03,
OL32147474W,"Oracle curriculum, developer section",Database management; SQL (Computer program language); Relational databases; Oracle (Computer file),Sideris Consulting Group,,
OL33279999W,Using IBM DB2 for I As a Storage Engine of MySQL,Database management; Relational databases; IBM Database 2.; MySQL (Electronic resource),Hernando Bedoya,,
OL33298619W,"Migrating from Oracle . . . to IBM Informix Dynamic Server on Linux, Unix, and Windows",Database management; Relational databases; Oracle (Computer file); INFORMIX Dynamic server; Linux; UNIX (Computer file); Microsoft Windows (Computer file),Chuck Ballard,,
OL4102110W,Introduction to INGRES,Database management; Ingres (Computer file); Relational databases,Margaret Zinky,20.93,
OL32613614W,Relational databases for agile developers,Relational databases; Agile software development,"Ballard, Ron (Database programmer)",,
OL5748935W,"Expert Oracle, Signature Edition Programming Techniques and Solutions for Oracle 7.3 through 8.1.7 (Expert One-On-One)",Software engineering; Reliability; Operating systems (Computers); Computers; Oracle (computer system); Relational databases; Oracle (Computer file),Thomas Kyte,168.09,
OL5748851W,Optimizing Oracle performance,Oracle (Computer file); Relational databases; SQL (Computer program language); Oracle (computer system),Cary V. Millsap,105.91,
OL5748934W,Expert Oracle Database Architecture,Database design; Relational databases; Oracle (Computer file); Reliability; Computer science; Computers,Thomas Kyte,89.21,
OL5649926W,Natürlichsprachliche Schnittstellen zu relationalen Datenbanken,Programming languages (Electronic computers); Relational databases; Semantics,Jürgen M. Janas,111.29,
OL5759405W,Oracle wait interface,Computer interfaces; Microsoft Windows (Computer file); Oracle (Computer file); Relational databases; Oracle (computer system),Richmond Shee,137.98,
OL5759515W,"Oracle database 10g high availability with RAC, Flashback & Data Guard",Oracle (Computer file); Relational databases; Oracle (computer system); Database management; COMPUTERS; Data Processing,"Hart, Matthew.",108.34,
OL5742605W,A first look at SQL server 2005 for developers,Relational databases; Client/server computing; SQL server; Database management,Bob Beauchemin,21.13,
OL5742984W,Oracle performance tuning for 10gR2,Oracle (Computer file); Relational databases; Oracle (computer system),Gavin Powell,67.17,
OL5420961W,Die universelle Relation als logische Sicht von Datenbanken,Relational databases,A Min Tjoa,110.18,
OL5293528W,"Eine neue, vollständig axiomatisierbare Klasse von Integritätsbedingungen für relationale Datenbanken",Relational databases,Walter Grassl,146.09,
OL5447442W,Fuzzy relational data bases,Expert systems (Computer science); Fuzzy systems; Relational databases; Database management; Information storage and retrieval systems,Maria Zemankova-Leech,64.44,
OL5854284W,Oracle Database 10g,Oracle (Computer file); Relational databases; Oracle (computer system); Database design,Ian Abramson,118.07,
OL5854285W,Oracle database 11g,Oracle (Computer file); Relational databases; Oracle (computer system),Ian Abramson,45.17,
OL5970440W,Oracle9i application server portal handbook,Oracle (Computer file); Oracle Portal; Relational databases,Steve Vandivier,51.96,
OL5992529W,"Professional SQL Server 7.0 development using SQL-DMO, SQL-NS & DTS",Database design; Relational databases; SQL server,Frank Miller,109.53,
