book_id,title,categories,author_names,price,description
OL18169560W,Beginning Oracle programming,PL/SQL (Computer program language); Oracle (Computer file); Database management; Relational databases; SQL (Computer program language); Computer programs; Object-oriented programming (Computer science),Sean Dillon; Christopher Beck; Thomas Kyte,131.28,
OL1809567W,Business objects companion,Business; BusinessObjects; Data processing; Relational databases,David Jackson,117.19,
OL1821394W,Sybase developer's guide,Relational databases; Sybase; Sybase (computer program),Daniel Worden,155.44,
OL1820635W,Oracle8 & Windows NT black book,Microsoft Windows NT; Oracle (Computer file); Relational databases,Mike Curtis,127.49,
OL17676618W,Guide to Oracle9i,Relational databases; Oracle (Computer file); ORACLE 9i; Database management,,130.09,
OL17671702W,Microsoft SQL Server 2000 Programming by Example [electronic resource],Database software; Relational databases; Client/server computing; SQL server; Sql server; Architecture client-serveur (Informatique); Bases de données relationnelles; COMPUTERS; Data Processing; Engineering & Applied Sciences; Computer Science,Joe Webb,44.76,
OL8167561W,Oracle DBA,Relational databases; Oracle (Computer file); Oracle (computer system),David Kreines,163.65,
OL1906055W,ODBC 3.5 developer's guide,Application software; Database design; Development; Microsoft ODBC; Relational databases,"Sanders, Roger E.",123.48,
OL5800868W,Oracle Database 10g new features,Oracle (Computer file); Relational databases; Oracle (computer system); Database management; COMPUTERS; Data Processing,"Freeman, Robert G.",154.66,
OL5798984W,MySQL,Relational databases; MySQL (Electronic resource); SQL (Computer program language); Mysql (computer program language),Vikram Vaswani,114.03,
OL7833084W,Oracle DBA tips & techniques,Database management; Oracle (Computer file); Relational databases,Sumit Sarin,131.9,
OL21094640W,Internet of Things,Internet programming; Object-oriented programming (computer science); Relational databases; Internet of things; Arduino (Programmable controller); Programmable controllers; Programming; Raspberry Pi (Computer); BeagleBone Black (Computer),Donald Norris,123.76,
OL8020512W,The Relational Database Dictionary,Relational databases; Dictionnaires français; Dictionaries; Bases de données relationnelles; Database management,Chris J. Date,165.22,
OL17502167W,Nodejs MongoDB and AngularJS Web Development,Internet programming; Node.js; Web site development; MongoDB; JavaScript (Computer program language); Javascript (computer program language); Relational databases; Software engineering,Brad Dayley,98.97,
OL4978999W,Handbook of relational database design,Database design; Relational databases; Database management,Candace C. Fleming,120.64,
OL19892756W,Oracle SOA Suite developer's guide,Service-oriented architecture (Computer science); Oracle (Computer file); Computer network architectures; Information resources management; Web services; Relational databases; Internet,Matt Wright,128.05,
OL18176340W,The practical SQL handbook : using SQL variants,"SQL (Computer program language); Sql (computer program language); Programming tools, languages; Relational databases",Judith S. Bowman; Sandra L. Emerson; Marcy Darnovsky,132.98,
OL2617138W,Database Concepts,Database management; Relational databases,David Kroenke,85.01,
OL21372113W,Adaptive Filter Design,Filters and filtration; Adaptive filters; Design and construction; Relational databases; Oracle (Computer file),Michael G. Larimore; C. Richard Johnson; John R. Treichler,,
OL9888874W,Oracle PL/SQL,PL/SQL (Computer program language); Database management; Relational databases; Oracle (Computer file),Lakshman Bulusu,56.66,
OL8273439W,e-Business for the Oracle DBA,Electronic commerce; Relational databases; Oracle (Computer file); Oracle (computer system),Meghraj Thakkar,155.02,
OL8584982W,Database Principles and Design,Relational databases; Database design; Bases de données relationnelles; Bases de données; Conception; Base de données relationnelle; Manuel; Base de données; Gestion,Colin Ritchie,,
OL20015561W,Sams teach yourself SQL in 24 hours,Relational databases; SQL (Computer program language); Database management; Sql (computer program language),Ryan K. Stephens,141.85,"""In just 24 sessions of one hour or less, readers learn how to use SQL to build effective databases, efficiently retrieve data, and manage everything from performance to security! Using this book's straightforward, step-by-step approach, readers learn hands-on through practical examples. Each lesson builds on what is already learned, giving a strong real-world foundation for success. The authors guide readers from the absolute basics to advanced techniques - including views, transactions, Web data publishing, and even powerful SQL extensions for Oracle and Microsoft SQL Server!""--www.pearsonhighered.com"
OL19546559W,"Type Inheritance and Relational Theory: Subtypes, Supertypes, and Substitutability",Database management; Relational databases; Electronic data processing,C. J. Date,,
OL5733106W,Understanding relational database query languages,Query languages (Computer science); Relational databases; SQL (Computer program language); Information storage and retrieval systems,Suzanne Wagner Dietrich,63.83,
OL6566451W,"Complex analysis, Joensuu 1978",Congresses; Functions of complex variables; Mathematical analysis; Machine Theory; Informatique; UML (Computer science); Reference; Database design; COMPUTERS; General; Hardware; Computer Literacy; Computer Science; Data Processing; Information Technology; Relational databases; Design and construction,"Colloquium on Complex Analysis (1978 Joensuu, Finland)",105.53,
OL19754468W,Oracle database 12C release 2 real application clusters handbook,Relational databases; Oracle (Computer file); Parallel processing (Electronic computers); Oracle (computer system),K. Gopalakrishnan,89.75,"Maintain a dynamic enterprise computing infrastructure with expert instruction from an Oracle ACE. Oracle Database 12c Release 2 Real Application Clusters Handbook: Concepts, Administration, Tuning, and Troubleshooting has been fully revised and updated to cover the latest tools and features. Find out how to prepare your hardware, deploy Oracle Real Application Clusters, and integrate seamless failover protection. Troubleshooting, performance tuning, and application development are also discussed in this comprehensive Oracle Press guide--"
OL5742985W,Oracle SQL jumpstart with examples,Oracle (Computer file); Relational databases; SQL (Computer program language); Oracle (computer system); Sql (computer program language),Gavin Powell,117.74,
OL6217276W,MySQL weekend crash course,MySQL (Electronic resource); SQL (Computer program language); Database management; Mysql (computer program language); Relational databases; Web databases; MySQL (Computer file),Jay Greenspan,,
OL16595641W,Database concepts,Relational databases; Database management,David Kroenke,145.35,
OL9208068W,"Associative Model of Data, The",Database management; Relational databases,Simon Guy Williams,41.02,
OL16922515W,Oracle Web Services Manager,Relational databases; Oracle (Computer file); Web services; COMPUTERS; Programming Languages; SQL,Sitaraman Lakshminarayanan,61.4,
OL4010398W,An introduction to the management of laboratory data,"Analytic Chemistry; Chemical laboratories; Chemistry; Data processing; Databases; Information storage and retrieval systems; Relational databases; Chemistry, analytic; Information storage and retrieval systems, chemistry",C. N. Hegarty,54.52,
OL16027413W,The database relational model,Relational databases; Relationele databanken,C. J. Date,150.29,
OL21133192W,Microsoft SQL Server 2016,Sql server; SQL (Computer program language); Client/server computing; Relational databases; Database management; SQL server,Dusan Petkovic,,
OL17427453W,Microsoft Access 2010 Comprehensive,Relational databases; Microsoft Access; Database management; Microsoft access (computer program),Gary B. Shelly,146.87,
OL15587225W,Database concepts,Relational databases; Database management,David Kroenke,72.89,
OL16768968W,Effective MySQL,Relational databases; MySQL (Electronic resource); Database management; Mysql (computer program language); Electronic data processing; Data recovery (computer science),Ronald Bradford,133.64,
OL19547807W,Beginning Oracle SQL: For Oracle Database 12c,SQL (Computer program language); SQL*PLUS (Computer program language); Relational databases; Database management; Oracle (Computer file); Oracle (computer system); Sql (computer program language),Tim Gorman,97.56,
OL19546817W,MySQL Cookbook: Solutions for Database Developers and Administrators,Mysql (computer program language); MySQL (Electronic resource); SQL (Computer program language); Database management; Relational databases; SQL (Langage de programmation); Bases de données; Gestion; Bases de données relationnelles; COMPUTERS; Programming Languages; SQL,Paul DuBois,,
OL8273770W,Microsoft SQL server 2008 analysis services unleashed,Client/server computing; Relational databases; SQL server; Sql server,Edward Melomed,49.0,
OL20319819W,Microsoft SQL Server 2014 Query Tuning & Optimization,Sql server; Sql (computer program language); Querying (Computer science); Database management; Relational databases; Client/server computing; SQL server,Benjamin Nevarez,,
OL20013196W,Sams teach yourself T-SQL in one hour a day,Relational databases; SQL (Computer program language); Sql server; Database management; Sql (computer program language),Alison Balter,61.34,
OL1752516W,Oracle Database 10g PL/SQL Programming,Oracle (Computer file); PL/SQL (Computer program language); SGBD = Systemes de gestion de bases de donnees; Sql (computer program language); Oracle (computer system); Relational databases,Scott Urman,,"""This fifth edition is principally rewritten, and includes all new examples and coverage of advanced topics like object oriented programming with PL/SQL, external routines, job scheduling, and more. This book covers both introductory and advanced material, and provides complete coverage of the PL/SQL language including new 10g features""--Introd."
OL16923270W,Mastering Oracle Scheduler in Oracle 11g databases,Relational databases; Oracle (Computer file); Production scheduling; Data processing; Database management,Ronald Rood,64.52,
OL34722958W,Introduction Access 2000,Database management; Relational databases; Management; Microsoft Access,Lisa Flournoy,,Teaches the introductory level components of Microsoft Access 2000.
OL16986484W,Probabilistic ranking techniques in relational databases,Ranking and selection (Statistics); Uncertainty (Information theory); Querying (Computer science); Relational databases; Uncertainty (information theory),Ihab F. Ilyas,,"Ranking queries are widely used in data exploration, data analysis and decision making scenarios. While most of the currently proposed ranking techniques focus on deterministic data, several emerging applications involve data that are imprecise or uncertain. Ranking uncertain data raises new challenges in query semantics and processing, making conventional methods inapplicable. Furthermore, the interplay between ranking and uncertainty models introduces new dimensions for ordering query results that do not exist in the traditional settings. This lecture describes new formulations and processing techniques for ranking queries on uncertain data. The formulations are based on marriage of traditional ranking semantics with possible worlds semantics under widely-adopted uncertainty models. In particular, we focus on discussing the impact of tuple-level and attribute-level uncertainty on the semantics and processing techniques of ranking queries. Under the tuple-level uncertainty model, we describe new processing techniques leveraging the capabilities of relational database systems to recognize and handle data uncertainty in score-based ranking. Under the attribute-level uncertainty model, we describe new probabilistic ranking models and a set of query evaluation algorithms, including sampling-based techniques. We also discuss supporting rank join queries on uncertain data, and we show how to extend current rank join methods to handle uncertainty in scoring attributes."
OL3488590W,Handbook for writing technical proposals that win contracts,"Technical writing; Research and development contracts; Proposal writing in research; Bible, juvenile literature; PL/SQL (Computer program language); Relational databases; Oracle (Computer file)",Donald V. Helgeson,123.92,
OL7799678W,MySQL and PHP from scratch,PHP (Computer program language); Relational databases; SQL (Computer program language); Php (computer program language); Mysql (computer program language),Wade Maxfield,44.15,
OL15473337W,The complete reference star schema,Relational databases; Data warehousing; COMPUTERS; Data Warehousing; Database Management; Object-oriented programming (computer science),Christopher Adamson,74.71,
OL22633578W,Building Accounting Systems Using Access 2010,Database management; Accounting; Data processing; Computer programs; Relational databases; Microsoft Access,James T. Perry,84.02,
OL19899378W,Relational methods in computer science,Datenverarbeitung; Mathematische Logik; Relationenalgebra; Relation algebras; Relation (Mathematik); Computer science; Mathematics; Aufsatzsammlung; Relational databases,C. Brink; W. Kahl; Gunther Schmidt,122.57,"The calculus of relations turned into an important conceptual and methodological tool in computer science. The methods presented in this book include questions of relational databases, applications to program specification, resource-conscious linear logic, semantic and refinement consideration, nonclassical logics for reasoning about programs, tabular methods in software construction, algorithm development, linguistic problems, followed by a comprehensive bibliography. The reader gets an overview of the wide-ranging applicability of relational methods in computer science."" ... While this is a multi-authored volume, the authors have done an excellent job of making it read like a single-authored work ... The book can be viewed as a set of snapshots of a family of research and researchers at one point in time. If you are interested in relational problems, I can think of no better introduction ..."" Computing Reviews."
OL2042019W,Pro Oracle Collaboration Suite 10g (Pro),Relational databases; Oracle (Computer file); Application software; Oracle (computer system),John Bernard Watson,55.03,
OL16634037W,OCA/OCP Oracle database 11g all-in-one exam guide,"Examinations; Certification; Relational databases; Study guides; SQL (Computer program language); Electronic data processing personnel; Electronic data processing personnel, certification; Database management; Oracle (computer system)",John Bernard Watson,122.93,
OL20188760W,OCA/OCP Oracle Database 12c All-in-One Exam Guide,"Sql (computer program language); Relational databases; Electronic data processing personnel, certification",John Bernard Watson; Roopesh Ramklass; Bob Bryla,133.75,
OL17507393W,Oracle Business Intelligence Discoverer 11g Handbook,Oracle (computer system); Relational databases; Database management; Information storage and retrieval systems; Computer programs; SQL*PLUS (Computer program language); Business,Michael Armstrong-Smith,100.45,
OL27094327W,Oracle Backup and Recovery Using RMAN,Relational databases; Oracle (computer system); Data recovery (computer science); Electronic data processing,Darl Kuhn; Scott Schulze,,
OL16975656W,SQL and relational theory,Relational databases; SQL (Computer program language); Sql (computer program language),C. J. Date,89.62,
OL12339701W,Conceptual modeling--ER 2001,Congresses; Database design; Relational databases,"International Conference on Conceptual Modeling (20th 2001 Yokohama, Japan)",125.46,
OL16922902W,"SQL, the complete reference",Relational databases; SQL (Computer program language); Sql (computer program language),James R. Groff; Paul N. Weinberg; Paul Weinberg; Andy Oppel,75.5,
OL15941494W,Database design using entity-relationship diagrams,Database design; Relational databases; Bases de données; Conception; Bases de données relationnelles; COMPUTERS; Databases; General,Sikha Bagui,31.89,
OL15685814W,Professional Oracle Weblogic Server,Oracle (computer system); Relational databases; Web servers; Web hosting; Java (Computer program language),Robert L. Patrick,,
OL16155432W,Mo hu xin xi XML yu shu ju ku jian mo ji shu yan jiu,Database design; Relational databases; Fuzzy systems; XML (Document markup language),Zongmin Ma,148.24,
OL16155431W,Mo hu xin xi XML yu shu ju ku jian mo ji shu yan jiu,Database design; Relational databases; Fuzzy systems; XML (Document markup language),Zongmin Ma,116.68,
OL17744282W,Microsoft SQL Server 2005 chu xue zhe zhi nan,Relational databases; Client/server computing; SQL server,Dusan Petkovic,144.16,
OL20775264W,Ling ji chu xue Visual Basic + SQL Server,Relational databases; Microsoft Visual Basic for Windows; BASIC (Computer program language); Client/server computing; SQL server,Yulin Li,84.1,
OL24446911W,SQL Server shi yong jiao cheng,Relational databases; Database management; Guan xi shu ju ku; Jiao cai; Shu ju ku guan li xi tong; Gao deng xue xiao; SQL server,Qifen Liu,66.23,
OL23216686W,SAP ASE 16/Sybase ASE administration,Client/server computing; Relational databases; SAP Adaptive server enterprise; Sybase,Jeffrey Garbus,159.18,
OL2999591W,Teach yourself Oracle Power Objects in 21 days,Oracle (Computer file); Relational databases; Oracle (computer system),"Grant, Tom",102.4,
OL19548618W,Murach's MySQL,Database design; Relational databases; MySQL (Electronic resource); SQL (Computer program language); Design; Mysql (computer program language); Sql (computer program language),Joel Murach,97.14,
OL21541533W,Oracle Unleashed,Oracle (computer system); Relational databases; Oracle (Computer file),Dan Hotka,156.04,
OL19543508W,PostgreSQL: Up and Running: A Practical Guide to the Advanced Open Source Database,Relational databases; PostgreSQL; Database management; Sql (computer program language); Open source software; Computers; Information technology; COMPUTERS; Databases; General,Regina O. Obe; Leo S. Hsu,113.0,
OL4107810W,Database design,Database design; Relational databases,Naphtali Rishe,69.33,
OL1885766W,Universal database management,Object-oriented databases; Database management; Relational databases,Cynthia Maro Saracco,104.93,
OL4519651W,Oracle PL/SQL Tuning,PL/SQL (Computer program language); Relational databases; Database management; Computer programming; Oracle (Computer file),Timothy Hall,116.1,
OL3681197W,The set model for database and information systems,Database design; Distributed databases; Relational databases,M. M. Gilula,60.81,
OL16916948W,The relational database dictionary,"Relational databases; Dictionaries; Computers, dictionaries",C. J. Date,105.72,
OL1821393W,Developing Sybase applications,Relational databases; Client/server computing,Daniel Worden,45.44,
OL1927787W,Developing Oracle Forms applications,Client/server computing; Oracle (Computer file); Relational databases,Albert Lulushi,75.83,
OL15056277W,Mastering Oracle Power Objects,Relational databases; Client/server computing; Oracle (Computer file); Oracle (computer system),Rick Greenwald,41.1,
OL17496972W,Oracle Big Data Handbook,Oracle (computer system); Relational databases; Database management; Big data,Mark F. Hornick,132.61,
OL20660223W,Shu ju ku ji qi ying yong (Access ji Excel) xue xi yu shi yan shi xun jiao cheng,Relational databases; Microsoft Access; Microsoft Excel (Computer file),Shenyong Xiao,92.88,
OL20691082W,Shu ju ku ji qi ying yong,Microsoft Excel (Computer file); Guan xi shu ju ku xi tong; Biao chu li ruan jian; Gao deng xue xiao; Relational databases; Jiao cai; Microsoft Access,Shenyong Xiao,97.58,
OL19548045W,Expert Oracle RAC 12c (The Expert's Voice),Oracle (computer system); Relational databases; Parallel processing (electronic computers); Database management; Parallel processing (Electronic computers); Oracle (Computer file),Riyaj Shamsudeen; Syed Jaffar Hussain; Kai Yu; Tariq Farooq,62.05,
OL4089098W,Relational databases,Database design; Relational databases,Ken S. Brathwaite,79.42,
OL1866475W,Using the new DB2,IBM Database 2.; Object-oriented databases; Relational databases,D. D. Chamberlin,56.27,
OL20288796W,SQL,Sql (computer program language); Relational databases; SQL (Computer program language),Andy Oppel,29.99,
OL2708441W,Oracle8 PL/SQL black book,Relational databases; PL/SQL (Computer program language),Mark Gokman,131.25,
OL19897070W,Professional Oracle programming,Relational databases; Oracle (Computer file),Rick Greenwald,84.41,
OL16355298W,Nested relations and complex objects in databases,Relational databases; Database management,,31.47,
OL16355515W,Interactive relational database design,Database design; Relational databases; Logic programming,,104.0,
OL3527954W,SQL in a Nutshell,SQL server; SQL (Computer program language); Client/server computing; Sql server; MySQL (Electronic resource); Sql (computer program language); Mysql (computer program language); Database software; SQL; SQL (Computer language); Computers - Languages / Programming; Computers; Computer Books: Database; SQL (Computer program language; Programming Languages - SQL; Computers / Programming Languages / SQL; Database Management - General,Kevin E. Kline; Kevin Kline; Daniel Kline; Brand Hunt; Russell J. T. Dyer; Russell Dyer,,
OL17707115W,Principles of distributed database systems,Distributed databases; Database software; Databases & data structures; Distributed Databases; Computers; Computers - Data Base Management; Textbooks; Computer Books: Database; Networking - General; Database Management - General; Computers / Database Management / General,M. Tamer Özsu; M. Tamer Ozsu; Patrick Valduriez,28.63,
OL11029935W,Practical business intelligence with SQL Server 2005,"Business intelligence; Client/server computing; SQL server; Database software; SQL; Programming Languages - C#; Computers - Data Base Management; Business Enterprise; Computers; New Business Enterprises; Computer Books: Database; Database Management - SQL Server; Computers - Languages / Programming; Computers / Database Management / General; Artificial Intelligence - General; Database Management - General; Sql server; Business, computer programs",John C. Hancock; John C. Hancock; Roger Toren,80.37,
OL15140461W,Gale directory of databases,Information services; Databases; Directories; Database software; Databases & data structures; Computers; Reference; General; Database Management - General,Gale Group,32.04,
OL12020042W,Practical PostgreSQL,"Database management; PostgreSQL; Database software; Databases & data structures; SQL; Computers - Data Base Management; Computers; Computer Books: Database; Programming Languages - SQL; Database Management - General; Computers / Data Base Management; Computers / Database Management / Data Mining; Computers / Database Management / General; Computers/Programming Languages - SQL; PostgreSQL, open source databases, object-relational, DBAs",John C Worsley; John C. Worsley; Joshua D. Drake,28.34,
OL6220956W,Beginning SQL,Computer Technology; Nonfiction; SQL (Computer program language); Database software; SQL; SQL (Computer language); Sql (Programming Language); Computers; Computers - Languages / Programming; Computer Books: Languages; SQL (Computer program language; Programming Languages - SQL; Computers / Programming Languages / SQL; Sql (computer program language),Paul Wilton; John Colby,,"Taking readers through the basics of the language, right up to some more advanced topics, this book is a practical, hands-on resource and aims to keep the reader involved at all timesFocuses on the SQL standard and is loaded with detailed examples and code; each chapter includes practice exercises that readers can challenge themselves with before looking at the sample solutions in the appendixPaul Wilton is a successful Wrox ""Beginning"" book author and is an ideal author to write for those who want a firm grasp of standard SQL before learning the details specific to a particular database productSQL is an international standard for manipulating data in databases and is used by database programmers in all major database systems: Microsoft, IBM, Oracle, MySQL, and many others"
OL15143524W,IPlanet application server,"Java (Computer program language); Web sites; Computer programs; Web servers; Design; Database software; Java & variants; Internet - Web Site Design; Business Enterprise; Object-Oriented Programming; Computers; Computers - Languages / Programming; Programming Languages - Java; Computer Books And Software; Programming - General; Networking - General; Computers / Internet / Web Site Design; Electronic Commerce; Web sites, design",David F. Ogren; David Ogren; Martin Gee,,
OL78375W,"Database--principles, programming, and performance",Database management; Database software; Databases & data structures; SQL; Database Management - General; Database Engineering; Computers; Computers - Data Base Management; Computer Books: Database; Information Storage & Retrieval; COM019000; COM; COM018000; COM021000; Computers / Information Storage & Retrieval; Data Processing - General; Disaster Recovery; Database design,Patrick O'Neil; Elizabeth O'Neil,151.88,
OL8701499W,Object management in distributed database systems for stationary and mobile computing environments,Distributed databases; Object-oriented databases; Database software; Databases & data structures; Database Management - General; Computer Science; Computers; Computers - Data Base Management; Computer Books: General; General; Computers / Computer Science,Wujuan Lin; B. Veeravalli,64.15,
