book_id,title,categories,author_names,price,description
OL4089102W,Relational theory,Database management; Relational databases,Ken S. Brathwaite,61.32,
OL3950709W,Object data management,Object-oriented databases; Relational databases; Database management,R. G. G. Cattell,30.51,
OL5748933W,Expert one-on-one Oracle,Oracle (Computer file); Relational databases; Logiciels; Bases de donnees; Bases de donnees relationnelles; Gestion; Oracle (Logiciel); Oracle (systeme informatique),Thomas Kyte,43.94,
OL5759533W,Easy Oracle SQL,Relational databases; Oracle (Computer file); SQL*PLUS (Computer program language); Database management,John Garmany,149.01,
OL6044919W,Oracle8i DBA,Certification; Database management; Electronic data processing personnel; Examinations; Oracle (Computer file); Study guides; Oracle; Electronic data processing per; Computer Books: General; Computer Architecture; Relational Databases; Computers; Computers - Certification; Database Management - Oracle; Certification Guides - General; Computers / Technical Skills; Computer Architecture - General; Oracle (computer system),Damir Bersinic; Todd Ross; Yury Sabinin,64.97,
OL6017458W,OCA Oracle Database 11g,"Certification; Computer Technology; Electronic data processing personnel; Examinations; Nonfiction; Oracle (Computer file); Study guides; Oracle (computer system); Database management; Relational databases; Electronic data processing personnel, certification","Watson, John",145.72,"A Fully Integrated Study System for OCA Exam 1Z0-052Prepare for the Oracle Certified Associate Oracle Database 11g Administration I exam with help from this exclusive Oracle Press guide. In each chapter, you'll find challenging exercises, practice questions, a two-minute drill, and a chapter summary to highlight what you've learned. This authoritative guide will help you pass the test and serve as your essential on-the-job reference. Get complete coverage of all OCA objectives for exam 1Z0-052, including:Database architectureCreating an Oracle DatabaseManaging the Oracle instanceConfiguring and managing the Oracle networkManaging database storage structuresAdministering user securityManaging schema objects, data and concurrency, and undo dataImplementing Oracle Database securityDatabase maintenance and performance managementBackup and recoveryMoving dataIntelligent infrastructure enhancementsOn the CD-ROM:One full practice exam that simulates the actual OCA examDetailed answers and explanationsScore report performance assessment toolComplete electronic bookBonus exam available free with online registrationNote: CD-ROM/DVD and other supplementary materials are not included."
OL5857562W,Beginning PHP and PostgreSQL e-commerce,Commerce électronique; Electronic commerce; Internet programming; PHP (Computer program language); PHP (Langage de programmation); PostgreSQL; Programmation sur Internet; Computer Programming; Databases & data structures; Internet; SQL; Internet - Web Site Design; Relational Databases; Computers; Computer - Internet; Computer Books: Languages; Programming Languages - SQL; Internet - World Wide Web; Computers / Programming / Software Development; Database Management - General; Programming Languages - General; PostgreSQL (Computer software); Php (computer program language); Sql (computer program language),Cristian Darie; Emilian Balanescu; Mihai Bucica,109.39,
OL5963714W,Microsoft SQL Server 2008 For Dummies (For Dummies (Computer/Tech)),Computer Technology; Nonfiction; SQL server; SQL (Computer program language); Client/server computing; Database management; Relational databases; Sql (computer program language); Sql server,Mike Chapple,47.55,"If you're a database administrator, you know Microsoft SQL Server 2008 is revolutionizing database development. Get up to speed on SQL Server 2008, impress your boss, and improve your company's data management -- read Microsoft SQL Server 2008 For Dummies!   SQL Server 2008 lets you build powerful databases and create database queries that give your organization the information it needs to excel. Microsoft SQL Server 2008 For Dummies helps you build the skills you need to set up, administer, and troubleshoot SQL Server 2008. You'll be able to:    Develop and maintain a SQL Server system  Design databases with integrity and efficiency  Turn data into information with SQL Server Reporting Services  Organize query results, summarizing data with aggregate functions and formatting output  Import large quantities of data with SSIS  Keep your server running smoothly  Protect data from prying eyes  Develop and implement a disaster recovery plan  Improve performance with database snapshots  Automate SQL Server 2008 administration     Microsoft SQL Server 2008 For Dummies is a great first step toward becoming a SQL Server 2008 pro!"
OL597310W,Oracle9i for Windows handbook,Microsoft Windows (Computer file); Oracle (Computer file); Relational databases,Anand Adkoli,105.1,
OL5839815W,Professional SQL server analysis services 2005 with MDX,Client/server computing; Computer Technology; MDX (Computer program language); Nonfiction; Relational databases; SQL server; Sql server,Sivakumar Harinath,152.5,"Written by the lead developers of Analysis Services at Microsoft, this book begins with an overview showing how Analysis Services and MDX can be used to build data warehouses and multidimensional databases  The authors then describe the development processes for building dimensions and cubes from various data sources  Demonstrating a variety of techniques in real-world scenarios, the book shows how MDX can be used to query databases to provide sophisticated analysis of business problems  Finally, the book explains how Analysis Services can be used with other components of SQL Server, including DTS, data mining, and Report Services, to provide comprehensive, end-to-end solutions"
OL2033082W,Sams teach yourself Microsoft SQL server 2000 in 21 days,Computer Technology; SQL server; Client/server computing; Nonfiction; Relational databases; Technology; Sql server,Richard Waymire,40.35,"A beginning level tutorial for administrators and developers interested in learning SQL Server 2000. 
Written by Richard Waymire--the lead Project Manager for the Microsoft SQL Server group. 
Microsoft SQL Server is the fastest growing database. 
SQL Server 2000 improves the product with additional features that will help continue this rapid growth. Includes updated coverage of JDBC driver for SQL Server, security best practices, and SQLXML 3.0. 
Sams Teach Yourself Microsoft SQL Server 2000 in 21 Days, Second Edition clearly defines and walks the reader through the features of SQL Server 2000. The reader is given tips and tricks for working within the new SQL Server 2000 product environment as well as working with SQL Server databases. The book will help the reader learn to: create and alter databases, manage security and implement permissions, protect, back-up and restore data, enforce and ensure data integrity, modify and manipulate data, and create views, triggers, functions, and stored procedures. 
Richard Waymire is a Program Manager with the SQL Server development team at Microsoft. He is also a Microsoft Certified Trainer (MCT), Solution Developer (MCSD), Database Administrator (MCDBA), and Systems Engineer + Internet (MCSE). He is a past president of the Pacific Northwest SQL Server User's Group. 
Rick Sawtell is both a Microsoft Certified Solutions Developer (MCSD) as well as a Microsoft Certified Trainer (MCT). He owns his own consulting firm and writes and trains on several Microsoft products."
OL19904646W,The Structure of the Relational Database Model,Database management; Relational databases,Jan Paredaens,94.26,"The book presents an overview of the most fundamental aspects of the theory that underlies the Relational Database Model. It provides exact definitions of widely accepted concepts, and also covers some recent research topics, making the book very suitable in classes on database theory."
OL18703562W,Oracle discoverer 10g handbook,Relational databases; Oracle (Computer file); Database management; Oracle (computer system),Darlene Armstrong-Smith; Michael Armstrong-Smith,124.38,
OL1906056W,DB2 universal database application programming interface (API) developer's guide,Application software; Database management; Development; IBM Database 2; IBM Database 2.; Application program interfaces (Computer software); SQL (Computer program language); Database design; Data warehousing; Relational databases; COMPUTERS; Data Processing; SQL (Langage de programmation); Bases de données; Conception; Entrepôts de données (Informatique); Bases de données relationnelles,"Sanders, Roger E.",119.08,
OL19036631W,SAS/ACCESS interface to SYBASE and SQL Server,Relational databases; Computer interfaces; SQL server; SAS/ACCESS; Sybase,SAS Institute,129.52,
OL19119890W,SAS/ACCESS 9.1.3 for relational databases,Relational databases; SAS/ACCESS,SAS Institute,62.77,
OL19547482W,SQL Server Query Performance Tuning,SQL server; Querying (Computer science); Database management; Client/server computing; Relational databases,Grant Fritchey,87.43,
OL19889797W,MySQL 5.1 plugin development,Relational databases; MySQL (Electronic resource); Open source software; Database management; Internet; Plug-ins (Computer programs); SQL (Computer program language),Sergei Golubchik,105.07,
OL19899362W,Relational database index design and the optimizers,Relational databases,Tapio Lahdenmaki; Mike Leach,168.77,
OL19889139W,MongoDB and PHP,Bases de données relationnelles; PHP (Langage de programmation); Relational databases; Php (computer program language); PHP (Computer program language); Database management; MongoDB,Steve Francia,53.2,"""What would happen if you optimized a data store for the operations application developers actually use? You'd arrive at MongoDB, the reliable document-oriented database. With this concise guide, you'll learn how to build elegant database applications with MongoDB and PHP. Written by the Chief Solutions Architect at 10gen--the company that develops and supports this open source database--this book takes you through MongoDB basics such as queries, read-write operations, and administration, and then dives into MapReduce, sharding, and other advanced topics. Get out of the relational database rut, and take advantage of a high-performing system optimized for operations and scale""--Résumé de l'éditeur."
OL19824303W,Advances in Conceptual Modeling,Software engineering; Database management; Information storage and retrieval systems; Information organization; Simulation and Modeling; Information retrieval; Computer simulation; Information Systems Applications (incl. Internet); Computer science; Artificial intelligence; Artificial Intelligence (incl. Robotics); Database design; Relational databases,Silvana Castano,158.16,"This book constitutes the refereed proceedings of workshops, held at the 31st International Conference on Conceptual Modeling, ER 2012, in Florence, Italy in October 2012. <br>The 32 revised  papers presented together with 6 demonstrations were carefully reviewed and selected from 84 submissions. The papers are organized in sections on the workshops CMS 2012, EDCM-NoCoDa, MODIC, MORE-BI, RIGIM, SeCoGIS and WISM. The workshops cover different conceptual modeling topics, from requirements, goal and service modeling, to evolution and change management, to non-conventional<br>data access, and they span a wide range of domains including Web information systems, geographical information systems, business intelligence, data-intensive computing."
OL1941218W,Oracle developer/2000 handbook,Computer software; Development; Oracle (Computer file); Relational databases,Michael W. Stowe,138.68,oracle developer book
OL1934861W,Inside relational databases,Microsoft Access; Relational databases; RELATIONAL DATA BASES; DATA BASES; SGBD = Systèmes de gestion de bases de données; DATA BASE MANAGEMENT SYSTEMS; Relationale Datenbank; DATA MANAGEMENT; Bases de données,Mark Whitehorn,33.01,
OL18550056W,IBM DB2 9 new features,IBM Database 2.; Relational databases; Database management; Ibm database 2 (computer system),Paul Zikopoulos; George Baklarz; Leon Katsnelson; Chris Eaton,138.68,
OL18664862W,Microsoft SQL Server 2005 analysis services,Relational databases; Client/server computing; MDX (Computer program language); SQL server; Database software; SQL; Computers - Data Base Management; Sql (Programming Language); Computers; Computer Books: Database; Database Management - General; Database Management - SQL Server; Computers / Database Management / General; Sql server,Edward Melomed; Irina Gorbach; Alexander Berger; Py Bateman,150.4,
OL18556923W,SQL Server 2008 query performance tuning distilled,SQL server; Client/server computing; Database management; Relational databases; Sql server,Grant Fritchey,,
OL1866611W,Oracle9i RAC,Beowulf clusters (Computer systems); Distributed processing; Electronic data processing; Oracle (Computer file); Parallel processing (Electronic computers); Relational databases,Michael R. Ault,35.17,
OL18753904W,ECDL advanced databases for Microsoft Office XP and Office 2003,Relational databases; Database management; Microsoft office (computer program),Judith Cuppage; Paul Holden,64.06,
OL19892736W,Oracle database 11gR2 performance tuning cookbook,Relational databases; Internet; Database management; Oracle (Computer file),Ciro Fiorillo,78.86,
OL19892722W,Oracle Advanced PL/SQL Developer Professional Guide,Internet; Electronic data processing personnel; Study guides; Certification; PL/SQL (Computer program language); Examinations; Database management; Relational databases; Oracle (Computer file),Saurabh Gupta,,Annotation
OL19839996W,Database modeling & design,Database design; Relational databases,Toby J. Teorey; Sam S. Lightstone; Tom Nadeau; H. V. Jagadish,101.38,
OL19886030W,Mastering Oracle8i,Relational databases; Oracle (Computer file),Robert G. Freeman; Mark D. Blomber; Mark D. Blomberg,110.64,
OL20816781W,Dynamic Oracle Performance Analytics,Oracle (computer system); Relational databases; Database management,Roger Cornejo,,
OL2073352W,Access 2000 developer's black book,Database management; Microsoft Access; Access; Relational Databases; Computers; Computers - Data Base Management; Computer Books And Software; Database Management - General,Lars Klander; Dave Mercer,63.71,
OL2098150W,Physical Database Design Using Oracle,Database design; Oracle (Computer file); Relational databases; Computer files; Bases de données; Conception; Bases de données relationnelles; COMPUTERS; Programming Languages; SQL,Donald K. Burleson,134.67,"Excerpts: Over the past 30 years, we've seen the evolution of a wide variety of systems analysis and design methodologies."
OL2098149W,Oracle9i High-Performance Tuning with STATSPACK,Oracle (computer system); Relational databases; Oracle (Computer file),Donald K. Burleson,97.89,Excerpts: Oracle tuning has always been the most difficult area of Oracle database management.
OL2098171W,SQL database programming with Java,Java (Computer program language); SQL (Computer program language); Database management; Database software; Java & variants; SQL; Relational Databases; Sql (Programming Language); Computers; Computers - Languages / Programming; Programming Languages - SQL; Computer Books And Software; Programming Languages - General; Database Management - General; Programming Languages - FORTRAN,Bill McCarty; Bill McCarthy,159.72,
OL18708746W,Data modeling and database design,Entity-relationship modeling; Computer architecture; Database design; Relational databases; SQL (Computer program language); Object-oriented programming (Computer science); Sql (computer program language); Object-oriented programming (computer science),Narayan S. Umanath; Richard W. Scamell,30.18,
OL18587222W,Oracle PL/SQL interactive workbook,Relational databases; PL/SQL (Computer program language); Oracle (Computer file); Oracle (computer system); Sql (computer program language),Benjamin Rosenzweig; Elena Silvestrova; Benjamin Rosenweig,80.16,
OL1930276W,Introducing relational database,Relational databases; Databases & data structures; Computer Programming,"Mayne, Alan J.; Alan J. Mayne; Michael B. Wood",,
OL19217829W,Query processing in parallel relational database systems,Relational databases; Parallel processing (Electronic computers); Database searching; Querying (Computer science),Hongjun Lu; Beng Chin Ooi; Kian-Lee Tan,136.83,
OL19192905W,Relational databases,Relational databases; Database management,D. A. Bell,154.77,
OL18352524W,Inside relational databases with examples in Access,Relational databases; Microsoft Access; Information storage and retrieval systems; Computer science; Database management; Microsoft access (computer program),Mark Whitehorn; Bill Marklyn,88.48,
OL18355805W,SQL and relational theory,Relational databases; SQL (Computer program language); Sql (computer program language); Database management,C. J. Date,96.6,
OL18665551W,Microsoft SQL server 2000 resource kit,Client/server computing; SQL server; Database software; Programming Languages - General; Relational Databases; Sql (Programming Language); Computers; Computers - Data Base Management; Computer Books And Software; Programming Languages - SQL; Database Management - SQL Server; Computers / General; Database Management - General,Microsoft Corporation,43.99,
OL1866617W,Oracle8 Administration and Management,Database management; Oracle (Computer file); Relational databases; Oracle (computer system),Michael R. Ault,125.46,
OL1866614W,Oracle DBA Exam Cram: Test 3 and Test 4: Exam,Relational databases; Oracle (Computer file),Michael R. Ault,20.13,
OL1832379W,The Jasmine object database,Jasmine (Computer file); Multimedia systems; Object-oriented databases; World Wide Web; Database software; Internet; Object-oriented programming (OOP); World Wide Web (Information re; Database Management - General; Multi-Media Hardware & Software; Relational Databases; Programming - Object Oriented Programming; Computers; Computers - Data Base Management; Computer Books: Database; Management Information Systems; Internet - Web Site Design; Computer Bks - Data Base Management,Setrag Khoshafian; Surapol Dasananda; Norayr Minassian; Mohammed Ketabchi,65.42,
OL1840928W,Relational database,Relational databases; Relationales Datenbanksystem; Relationele databanken; Bases de données relationnelles; Bases de donnees relationnelles,C. J. Date,116.41,
OL1840911W,"Databases, types and the relational model",Object-oriented databases; Relational databases; Databases & data structures; Computers; Computers - Data Base Management; Textbooks; Computer Books: Database; Database Management - General; Computers / Database Management / General,C. J. Date; Hugh Darwen,27.28,
OL19836945W,Conceptual Modeling,Software engineering; Data Mining and Knowledge Discovery; Database management; Information storage and retrieval systems; Information organization; Simulation and Modeling; Information retrieval; Logic design; Logics and Meanings of Programs; Computer simulation; Data mining; Computer science; Database design; Relational databases; System analysis; Congresses; Web databases,Paolo Atzeni,116.47,"This book constitutes the refereed proceedings of the 31st International Conference on Conceptual Modeling, ER 2012, held in Florence, Italy, in October 2012. <br>The 24 regular papers presented together with 13 short papers, 6 poster papers and 3 keynotes were carefully reviewed and selected from 141 submissions. The papers are organized in topical sections on understandability and cognitive approaches; conceptual modeling for datawarehousing and business intelligence; extraction, discovery and clustering; search and documents; data and process modeling; ontology based approaches; variability and evolution; adaptation, preferences and query refinement; queries, matching and topic search; and conceptual modeling in action."
OL1752517W,Oracle PL/SQL programming,Oracle (Computer file); PL/SQL (Computer program language); Relational databases; SQL*PLUS (Computer program language),Scott Urman,107.36,
OL21551073W,"Database Concepts, Global Edition",Database management; Relational databases,David Kroenke,96.16,
OL21397937W,Understanding DB2,Database management; Relational databases; IBM Database 2.; Ibm database 2 (computer system); Bases de datos relacionales,Raul F. Chong; Clara Liu; Sylvia F. Qi; Dwaine R. Snow,20.71,
OL1969351W,JDBC,Database design; Relational databases; Java (Computer program language),Art Taylor,24.15,
OL2354795W,Visual FoxPro programming basics,Application software; Database management; Development; Relational databases; Visual FoxPro for Windows,Tom Stearns,61.18,
OL22122085W,Oracle discoverer handbook,Relational databases; Oracle (Computer file),Michael Armstrong-Smith; Darlene Armstrong-Smith,87.13,
OL23988010W,Oracle tuning,Database management; Relational databases; Oracle (Computer file),Alexey B. Danchenkov; Donald K. Burleson,122.07,
OL21466875W,Beginning Oracle SQL,Oracle (computer system); Sql (computer program language); Relational databases; Database management,Lex deHaan; Karen Morton; Tim Gorman; Inger Jorgensen; Daniel Fink,129.01,
OL21423727W,SQL Server 2008 Administration Instant Reference,Client/server computing; Relational databases; Sql server,Michael Lee; Mike Mansfield; Mike Mansfield,58.33,
OL2034630W,Fast track MCSE,"Certification; Client/server computing; Electronic data processing personnel; Examinations; Microsoft software; SQL server; Study guides; Computer Communications & Networking; Database software; Databases & data structures; SQL; Relational Databases; Computers - Certification; Sql (Programming Language); Computers; Programming Languages - General; Computer Books: Database; Networking - General; Database Management - General; Certification - MCSE; Certification Guides - Msce; Database Management - SQL Server; Certification Guides - MCSE; Study guides, home study & revision notes; Sql server; Examinations, study guides",Andy Ruth; Anil Desai,56.64,
OL2035972W,Database development for dummies,Database design; Relational databases; Database management; Web databases,Allen G. Taylor,28.6,"Excerpts: After millions of personal computers had been sold and installed in companies large and small, people came to a fundamental realization."
OL2035974W,SQL Für Dummies,Database management; Computer programming; Relational databases; Sql (computer program language),Allen G. Taylor,,
OL2035964W,SQL all-in-one desk reference for dummies,Relational databases; SQL (Computer program language); Computer Technology; Management; Nonfiction; Sql (computer program language),Allen G. Taylor,126.47,"SQL is the international standard language for creating and maintaining relational databases. This book is a compendium of information about SQL and relational database design, development, and maintenance. The nine mini-books cover the full spectrum of issues that arise in building, using, and maintaining relational database systems.   Book I: SQL Concepts   Book II: Relational Database Development   Book III: SQL Queries   Book IV: Data Security   Book V: SQL and Programming   Book VI: SQL and XML   Book VII: Database Tuning Overview   Book VIII: Appendixes"
OL19323570W,CodeNotes for Oracle 9i,Java (Computer program language); Relational databases; Oracle (Computer file),Gregory Brill,119.67,
OL20869743W,Advances in Conceptual Modeling,Database design; Relational databases,Manfred A. Jeusfeld; Kamalakar Karlapalem,65.89,
OL2435168W,Oracle developer's guide,Oracle (Computer file); Relational databases; SQL (Computer program language),David McClanahan,71.93,
OL24271536W,Incomplete data and data dependencies in relational databases,Relational databases; Querying (Computer science); Data mining; Database design; COMPUTERS; Programming Languages; SQL; Database searching,Sergio Greco,154.21,"The chase has long been used as a central tool to analyze dependencies and their effect on queries. It has been applied to different relevant problems in database theory such as query optimization, query containment and equivalence, dependency implication, and database schema design. Recent years have seen a renewed interest in the chase as an important tool in several database applications, such as data exchange and integration, query answering in incomplete data, and many others. It is well known that the chase algorithm might be non-terminating and thus, in order for it to find practical applicability, it is crucial to identify cases where its termination is guaranteed. Another important aspect to consider when dealing with the chase is that it can introduce null values into the database, thereby leading to incomplete data. Thus, in several scenarios where the chase is used the problem of dealing with data dependencies and incomplete data arises. This book discusses fundamental issues concerning data dependencies and incomplete data with a particular focus on the chase and its applications in different database areas. We report recent results about the crucial issue of identifying conditions that guarantee the chase termination. Different database applications where the chase is a central tool are discussed with particular attention devoted to query answering in the presence of data dependencies and database schema design."
